{"$schema":"https://json-schema.org/draft/2020-12/schema","type":"object","additionalProperties":false,"required":["reply","proposals","card_conclusion","card_reason","observations","questions"],"properties":{"reply":{"type":"string"},"proposals":{"type":"array","items":{"type":"object","additionalProperties":false,"required":["kind","title","body"],"properties":{"kind":{"enum":["exploration","card","decision","fdr","adr"]},"title":{"type":"string"},"body":{"type":"string"}}}},"card_conclusion":{"type":"string"},"card_reason":{"type":"string"},"observations":{"type":"array","items":{"type":"object","additionalProperties":false,"required":["kind","content"],"properties":{"kind":{"enum":["claim","hypothesis","unknown"]},"content":{"type":"string","minLength":1}}}},"questions":{"type":"array","items":{"type":"object","additionalProperties":false,"required":["question","reason"],"properties":{"question":{"type":"string","minLength":1},"reason":{"type":"string"}}}}}}
