{
  "reply": "Entiendo que las actividades deben publicarse y que la inscripción busca organizar la participación. Aún no sé qué personas pueden inscribirse ni cómo se asignan las plazas.",
  "proposals": [],
  "card_conclusion": "",
  "card_reason": "",
  "observations": [
    {"kind": "claim", "content": "La persona quiere publicar actividades."},
    {"kind": "hypothesis", "content": "La inscripción podría tener un límite de plazas."},
    {"kind": "unknown", "content": "No se ha indicado quién puede inscribirse."}
  ],
  "questions": [
    {"question": "¿Quién puede inscribirse en una actividad?", "reason": "Define el alcance de acceso y los casos de uso."}
  ]
}
